{
  "$schema": "../../profile.schema.json",
  "name": "ing",
  "pretty_name": "Infinity Ground",
  "category": "Gaming",
  "tags": ["AI"],
  "l2": true,
  "description": "Enabling everyone to create interactive entertainment.",
  "summary": "Enabling everyone to create using AI & blockchain",
  "color": "#FFFFFF",
  "status": "live",
  "vip": {
    "actions": [
      {
        "title": "To be Infinity",
        "description": "Create a better future."
      }
    ]
  },
  "social": {
    "website": "https://www.infinityg.ai"
  }
}
