{
  "$schema": "../../profile.schema.json",
  "name": "cabal",
  "pretty_name": "Cabal",
  "category": "DeFi",
  "l2": false,
  "description": "The Very Important Protocol for Initia's VIP.",
  "color": "#54EEE7",
  "status": "upcoming",
  "social": {
    "website": "https://thecabal.xyz"
  }
}
