{
  "$schema": "../../profile.schema.json",
  "name": "minity",
  "pretty_name": "Minity",
  "category": "Portfolio",
  "tags": ["Tooling"],
  "l2": false,
  "description": "Track your assets, DeFi Positions, and NFTs across every interwoven rollup.",
  "summary": "Track your assets and positions across L1 and L2s",
  "color": "#FFFFFF",
  "status": "live",
  "social": {
    "website": "https://minity.xyz"
  }
}
